{
  "schema_version": "account_positions_panel.v1",
  "workbench": "Account Workbench",
  "panel": "Account Positions Panel",
  "route": "/accounts/{account_id}/positions",
  "fixture_state": "current_positions",
  "context": {
    "trading_day": "2026-06-14",
    "session_id": "account-workbench.fixture.20260614.004",
    "run_id": "account-positions.fixture.e100-current.001",
    "reducer_checkpoint_id": "account-positions.checkpoint.e100.001",
    "reducer_checkpoint_ts": "2026-06-14T14:48:12Z",
    "stream_state": "healthy",
    "projection_owner": "account-console-contracts",
    "source_authority": "deterministic_fixture"
  },
  "account": {
    "account_id": "acct.demo-19053",
    "account_alias": "19053",
    "account_kind": "real_feed_sandbox_paper"
  },
  "positions": [
    {
      "account_id": "acct.demo-19053",
      "instrument": "rb2610",
      "direction": "LONG",
      "net_qty": 3,
      "today_qty": 0,
      "yesterday_qty": 3,
      "available_qty": 3,
      "frozen_qty": 0,
      "average_price": 3156.0,
      "market_price": 3158.0,
      "market_value": 9474.0,
      "unrealized_pnl": 42.0,
      "carryover_ref": "fixture://account-workbench/carryover/acct.demo-19053/rb2610/2026-06-14",
      "settlement_ref": "fixture://account-workbench/settlement/acct.demo-19053/2026-06-14",
      "source_ref": "D:/Nautilus/nautilus_ctp_adapter/output/reports/p077-paper-lifecycle/20260614T130516Z/p077_t6_e100_bounded_paper_close_yesterday_filled_reconciled.json",
      "checksum": "sha256:698340f03f5eb6ca03aa3006d295024850bf2a53a5687dee1178df421c635dbc"
    }
  ],
  "blockers": [],
  "source_refs": [
    {
      "kind": "position_projection",
      "owner": "account-console-contracts",
      "source_ref": "fixture://account-workbench/positions/acct.demo-19053/rb2610/2026-06-14",
      "checksum": "sha256:8181818181818181818181818181818181818181818181818181818181818181",
      "authority": "deterministic position fixture; not account or ledger truth"
    },
    {
      "kind": "external_lifecycle_ref",
      "owner": "nautilus_ctp_adapter",
      "source_ref": "D:/Nautilus/nautilus_ctp_adapter/output/reports/p077-paper-lifecycle/20260614T130516Z/p077_t6_e100_bounded_paper_close_yesterday_filled_reconciled.json",
      "checksum": "sha256:698340f03f5eb6ca03aa3006d295024850bf2a53a5687dee1178df421c635dbc",
      "authority": "external owner artifact projected read-only"
    }
  ],
  "boundaries": {
    "read_only_projection": true,
    "runtime_truth": false,
    "account_truth": false,
    "order_truth": false,
    "ledger_truth": false,
    "ui_truth": false,
    "paper_ready": false,
    "live_ready": false,
    "broker_tradable": false,
    "admission_truth": false,
    "capital_truth": false,
    "action_controls": false
  },
  "rejection_rules": [
    "Reject this fixture as Account Console position truth; it is a read-only projection example.",
    "Reject browser calculations of available quantity, carryover or T+1 state.",
    "Reject screenshots, rolling debug paths and raw report text as replacement position authority."
  ]
}
